Sheet: Sheet1
A1: Current (mA) | B1: VH plus | C1: VH minus | D1: Mean VH (mV) | E1: VH/I | F1: 1900 gauss | G1: 15 v 3.5 a
A2: 5.03 | B2: 4.6 | C2: 4.5 | D2: of:=AVERAGE([.B2];[.C2]) -> 4.55 | E2: of:=[.D2]/[.A2] -> 0.904572564612326
A3: 5.53 | B3: 5 | C3: 4.9 | D3: of:=AVERAGE([.B3];[.C3]) -> 4.95 | E3: of:=[.D3]/[.A3] -> 0.895117540687161
A4: 5.98 | B4: 5.4 | C4: 5.3 | D4: of:=AVERAGE([.B4];[.C4]) -> 5.35 | E4: of:=[.D4]/[.A4] -> 0.894648829431438
A5: 6.52 | B5: 6 | C5: 5.9 | D5: of:=AVERAGE([.B5];[.C5]) -> 5.95 | E5: of:=[.D5]/[.A5] -> 0.912576687116565
A6: 7 | B6: 6.4 | C6: 6.6 | D6: of:=AVERAGE([.B6];[.C6]) -> 6.5 | E6: of:=[.D6]/[.A6] -> 0.928571428571429
A7: 7.49 | B7: 6.9 | C7: 6.8 | D7: of:=AVERAGE([.B7];[.C7]) -> 6.85 | E7: of:=[.D7]/[.A7] -> 0.914552736982644
A8: 8.08 | B8: 7.5 | C8: 7.4 | D8: of:=AVERAGE([.B8];[.C8]) -> 7.45 | E8: of:=[.D8]/[.A8] -> 0.922029702970297
A9: 8.5 | B9: 7.9 | C9: 7.8 | D9: of:=AVERAGE([.B9];[.C9]) -> 7.85 | E9: of:=[.D9]/[.A9] -> 0.923529411764706
A10: 9.05 | B10: 8.4 | C10: 8.3 | D10: of:=AVERAGE([.B10];[.C10]) -> 8.35 | E10: of:=[.D10]/[.A10] -> 0.922651933701658
A11: 9.52 | B11: 8.9 | C11: 8.8 | D11: of:=AVERAGE([.B11];[.C11]) -> 8.85 | E11: of:=[.D11]/[.A11] -> 0.929621848739496
A12: 10.04 | B12: 9.4 | C12: 9.3 | D12: of:=AVERAGE([.B12];[.C12]) -> 9.35 | E12: of:=[.D12]/[.A12] -> 0.931274900398407
A13: 10.54 | B13: 9.9 | C13: 9.8 | D13: of:=AVERAGE([.B13];[.C13]) -> 9.85 | E13: of:=[.D13]/[.A13] -> 0.934535104364327
A14: 10.99 | B14: 10.1 | C14: 10.2 | D14: of:=AVERAGE([.B14];[.C14]) -> 10.15 | E14: of:=[.D14]/[.A14] -> 0.923566878980892
A15: 11.49 | B15: 10.6 | C15: 10.5 | D15: of:=AVERAGE([.B15];[.C15]) -> 10.55 | E15: of:=[.D15]/[.A15] -> 0.918189730200174
A16: 12 | B16: 11 | C16: 11.1 | D16: of:=AVERAGE([.B16];[.C16]) -> 11.05 | E16: of:=[.D16]/[.A16] -> 0.920833333333333
A17: 12.49 | B17: 11.5 | C17: 11.4 | D17: of:=AVERAGE([.B17];[.C17]) -> 11.45 | E17: of:=[.D17]/[.A17] -> 0.916733386709367
A18: 12.98 | B18: 12 | C18: 11.9 | D18: of:=AVERAGE([.B18];[.C18]) -> 11.95 | E18: of:=[.D18]/[.A18] -> 0.920647149460709
A19: 13.75 | B19: 12.7 | C19: 12.6 | D19: of:=AVERAGE([.B19];[.C19]) -> 12.65 | E19: of:=[.D19]/[.A19] -> 0.92
D20: mean resistance (ohm) | E20: of:=AVERAGE([.E2:.E19]) -> 0.918536287112496