Sheet: Sheet1
A1: Temperature (C) | B1: Voltage (mV) | C1: Temperature (K) | D1: T^-1 x 1000
A2: 24 | C2: of:=[.A2]+273 -> 297 | D2: of:=([.C2])^-1 * 1000 -> 3.36700336700337
A3: 30 | C3: of:=[.A3]+273 -> 303 | D3: of:=([.C3])^-1 * 1000 -> 3.3003300330033
A4: 40 | C4: of:=[.A4]+273 -> 313 | D4: of:=([.C4])^-1 * 1000 -> 3.19488817891374
A5: 50 | C5: of:=[.A5]+273 -> 323 | D5: of:=([.C5])^-1 * 1000 -> 3.09597523219814
A6: 60 | C6: of:=[.A6]+273 -> 333 | D6: of:=([.C6])^-1 * 1000 -> 3.003003003003
A7: 70 | C7: of:=[.A7]+273 -> 343 | D7: of:=([.C7])^-1 * 1000 -> 2.91545189504373
A8: 80 | C8: of:=[.A8]+273 -> 353 | D8: of:=([.C8])^-1 * 1000 -> 2.8328611898017
A9: 90 | C9: of:=[.A9]+273 -> 363 | D9: of:=([.C9])^-1 * 1000 -> 2.75482093663912
A10: 100 | C10: of:=[.A10]+273 -> 373 | D10: of:=([.C10])^-1 * 1000 -> 2.68096514745308
A11: 110 | C11: of:=[.A11]+273 -> 383 | D11: of:=([.C11])^-1 * 1000 -> 2.61096605744125
A12: 120 | C12: of:=[.A12]+273 -> 393 | D12: of:=([.C12])^-1 * 1000 -> 2.54452926208651
A13: 130 | C13: of:=[.A13]+273 -> 403 | D13: of:=([.C13])^-1 * 1000 -> 2.48138957816377
A14: 140 | C14: of:=[.A14]+273 -> 413 | D14: of:=([.C14])^-1 * 1000 -> 2.42130750605327
A15: 150 | C15: of:=[.A15]+273 -> 423 | D15: of:=([.C15])^-1 * 1000 -> 2.36406619385343
A16: 160 | C16: of:=[.A16]+273 -> 433 | D16: of:=([.C16])^-1 * 1000 -> 2.3094688221709
A18: 8.07 mA

Sheet: Sheet2
A1: W/s | B1: f(W/s)
A2: 0.1 | B2: 13.863
A3: 0.141 | B3: 9.704
A4: 0.2 | B4: 6.931
A5: 0.333 | B5: 4.159
A6: 0.5 | B6: 2.78
A7: 1 | B7: 1.504
A8: 1.414 | B8: 1.223
A9: 2 | B9: 1.04
A10: 3.333 | B10: 1.0228
A11: 5 | B11: 1.007
A12: 10 | B12: 1.00045